Title,Language,Release Date,Genre(s),Runtime (mins),Director,Lead Actor(s),IMDb Rating (/10),BookMyShow Rating (/10),Average Rating (/10)
Sattham,Tamil,22/07/19,Thriller,154,Mani Shankar Iyer,Kamaal Lenin; Santhosh; Rohith Muralidharan; Nakshatra Rao,8.8,,
Kaithi,Tamil,25/10/19,Action; Thriller,146,Lokesh Kanagaraj,Karthi; Narain; Arjun Das,8.4,,
KD (A) Karuppudurai,Tamil,27/06/19,Drama,123,Seenu Ramasamy,Karuppu; others‡,8.4,,
Asuran,Tamil,04/10/19,Action; Drama,141,Vetrimaaran,Dhanush; Manju Warrier,8.4,,
Kurukshetra 3D,Tamil,08/03/19,Historical; War,135,Nagana,Yogesh Kumar; Gayathrie,8.4,,
Single Slipper Size – 7,Tamil,10/05/19,Crime; Thriller,120,Suhana Rajendran,Parthiban Radhakrishnan; Gayathrie,8.3,,
Saaral,Tamil,29/11/19,Mystery; Thriller,115,Prabhu,Deepak Paramesh; Lakshmi Menon,8.3,,
Super Deluxe,Tamil,29/03/19,Drama; Thriller,176,Thiagarajan Kumararaja,Vijay Sethupathi; Fahadh Faasil; Samantha Ruth Prabhu,8.2,,
Thadam,Tamil,30/08/19,Crime; Mystery,138,Magizh Thirumeni,Arun Vijay; Yogi Babu; Tanya Hope,8.1,,
Kudimagan,Tamil,21/06/19,Drama,125,Esakki Karvannan,Vinoth Kishan; Viji Chandrasekhar,8.1,,
Insha Allah – An Inception at Closure,Tamil,05/04/19,Drama,84,Rajapandi,Samuthirakani; Sunaina Yella; Sara Arjun; Leela Samson,8,,
Sillu Karuppatti,Tamil,15/03/19,Romance; Drama; Anthology,153,Halitha Shameem,"Priyanka K, Nivedithaa Sathish, Kathir, Dhilip Subbarayan",7.9,,
To Let,Tamil,21/02/19,Drama,99,Chezhiyan,Santhosh Sreeram; Sheela; Dharun; Aadhira Pandilakshmi,7.9,,
Embiran,Tamil,10/05/19,Romance,90‡,SK Jeeva,Krishna Pandi,7.9,,
Jiivi,Tamil,07/06/19,Thriller; Drama,122,V.J. Gopinath,"Vetri, Cheran, Santhosh Prathap",7.7,,
Nerkonda Paarvai,Tamil,08/08/19,Courtroom; Drama,157,H. Vinoth,"Ajith Kumar, Shraddha Srinath, Andrea Jeremiah",7.7,,
Magamuni,Tamil,27/09/19,Crime; Drama,153,Santhakumar,"Arya, Indhuja Ravichandran, Mahima Nambiar",7.6,,
Kannadi,Tamil,20/12/19,Thriller; Drama,117‡,Nibir Mohan,Vinod Raj; More info not found,7.6,,
Raatchasi,Tamil,20/09/19,Drama,134,Syed Ahmar Rashaad,"Jyotika, Hareesh Peradi, D. Imman",7.4,,
Kalavu,Tamil,09/02/19,Crime; Thriller,,Murali Karthick,Kalaiyarasan; Karunakaran,7.3,,
Petta,Tamil,10/01/19,Action; Drama,171,Karthik Subbaraj,Rajinikanth; Vijay Sethupathi; Nawazuddin Siddiqui,7.2,,
Mehandi Circus,Tamil,12/07/19,Romance; Drama,135,Muthukumar,Madhampatty Rangaraj; Shweta Tripathi,7.2,,
Miga Miga Avasaram,Tamil,08/03/19,Drama,96,Anand Ravichandran,Aravindhan; Muthuraman; Sri Priyanka,7.2,,
Bakrid,Tamil,02/08/19,Drama; Comedy,121,Jagadeesan Subu,Vasundhara Kashyap; Vikranth,7.2,,
Thorati,Tamil,21/06/19,Drama,128,P. Marimuthu,Sri Gouri Priya; Thamizh,7.2,,
Maadathy: An Unfairy Tale,Tamil,15/11/19,Drama; Folk,90,Leena Manimekalai,Rohini Hattangadi; Aadukalam Naren,7.1,,
Viswasam,Tamil,10/01/19,Action; Drama,156,Siva,Ajith Kumar; Nayanthara; Jagapathi Babu,7.1,,
Kolaigaran,Tamil,01/11/19,Crime; Thriller,130,Andrew Louis,Arjun Sarja; Vijay Antony; Ashima Narwal,7.1,,
Gundu,Tamil,22/11/19,Crime; Thriller,141,TP Gajendran,Riythvika Panneerselvam; Dinesh; Anandhi,7.1,,
Sivaranjiniyum Innum Sila Pengalum,Tamil,19/12/19,Drama; Anthology,123,Vasanth,Lakshmi Priyaa Chandramouli; Kalieaswari Srinivasan; Parvathi Menon,7.1,,
Nedunalvaadai,Tamil,15/03/19,Drama,122,Selvakannan,Poo Ramu; Elvis Alexander; Anjali Nair,7.1,,
Comali,Tamil,15/08/19,Comedy; Drama; Adventure,142,Pradeep Ranganathan,Ravi Mohan; Kajal Aggarwal; Yogi Babu; Samyuktha Hegde; K. S. Ravikumar,7,,
Sivappu Manjal Pachai,Tamil,14/06/19,Action; Drama,140,K. S. Thangasamy,G. V. Prakash Kumar; Lijomol Jose,7,,
Uriyadi 2,Tamil,03/05/19,Thriller; Action,119,Vijay Kumar,Lenin Vijay; others,7,,
House Owner,Tamil,15/02/19,Drama; Thriller,109,Lakshmy Ramakrishnan,Jayaraj Subramaniam; Charulatha Balakrishnan,7,,
The Prophet,Tamil,27/09/19,Biography; Drama,63,G. Marimuthu,Sridhar (Devaduta),7,,
Game Over,Tamil,05/04/19,Thriller; Horror,102,Ashwin Saravanan,Taapsee Pannu,6.9,,
LKG,Tamil,22/02/19,Political Satire; Comedy,124,K. R. Prabhu,RJ Balaji; Priya Anand,6.9,,
The Mosquito Philosophy,Tamil,10/05/19,Comedy; Drama,70,N. Harikumar,Vishakha Singh; same,6.9,,
Bow Bow,Tamil,12/07/19,Family; Drama,110,Mohan Krishna,Lisha; Siddharthan,6.8,,
Aghavan,Tamil,05/02/19,Action; Drama; Thriller,152,APG Elumalai,Kishore Ravichandran; Chirashree Anchan; Nithya Shetty,6.8,,
Bigil,Tamil,25/10/19,Action; Sports; Drama,179,Atlee,Vijay; Nayanthara; Jackie Shroff; Vivek; Kathir,6.7,,
V1 Murder Case,Tamil,22/03/19,Crime; Thriller,112,Rupesh Paul,Prashanth; Chandini Tamilarasan,6.7,,
Thambi,Tamil,29/11/19,Crime; Drama,149,Jeethu Joseph,Karthi; Priya Bhavani Shankar; Jyothika,6.7,,
Kaalidas,Tamil,18/10/19,Thriller; Crime,126,Vijay Kumar,Suresh Chandra Menon; Bharath Srinivasan; Aadhav Kannadasan,6.7,,
Monster,Tamil,28/11/19,Comedy; Horror,139,Bhanushankar,SJ Suryah; Karunakaran; Priya Bhavani Shankar,6.7,,
Azhiyatha Kolangal 2,Tamil,15/11/19,Drama,,B. Lenin,S. J. Suryah; etc.,6.7,,
Uchakattam,Tamil,05/07/19,Thriller; Drama,,Arivazhagan,unknown,6.7,,
Thozhar Venkatesan,Tamil,01/09/19,Drama,112,Mahendran,unknown,6.6,,
Champion,Tamil,29/11/19,Sports; Drama,109,Akash Gandhi,Mirnalini Ravi; Narain,6.6,,
Bodhai Yeri Budhi Maari,Tamil,15/02/19,Comedy; Thriller,124,Suresh.R.Kumar,Harish Kalyan; Anandhi  ,6.6,,
Rocky: The Revenge,Tamil,28/06/19,Action; Drama,152,Gopi Krishna,Atharvaa Murali; Hansika Motwani,6.6,,
100,Tamil,22/11/19,Crime; Drama,141,Sam Anton,Atharvaa Murali; Hansika Motwani ,6.5,,
Natpe Thunai,Tamil,31/05/19,Sports; Drama,154,D. Parthiban,Hiphop Tamizha Adhi; Kousalya; Anagha L.K.,6.4,,
Ispade Rajavum Idhaya Raniyum,Tamil,21/06/19,Romantic; Drama,153,Yuthan Balaji,Harish Kalyan; Ma Ka Pa Anand; Shilpa Manjunath,6.4,,
Thirumanam,Tamil,25/10/19,Family; Drama,156,Cheran,Jai; Keerthy Suresh,6.4,,
Pizhai,Tamil,18/01/19,Children; Drama,112,T. V. Chandran,Young cast,6.4,,
Hero,Tamil,19/07/19,Action; Drama,164,PS Mithran,Sivakarthikeyan; Abhay Deol; Arjun Sarja; Kalyani Priyadarshan,6.3,,
Suttu Pidikka Utharavu,Tamil,01/11/19,Action; Thriller,136,Velraj,Suseenthiran; Mysskin; Vikranth,6.3,,
Kattumaram,Tamil,15/01/19,Drama,73,Velu Prabhakaran,anoj; tau—,6.3,,
Kaappaan,Tamil,20/09/19,Action; Thriller,166,K. V. Anand,Suriya; Mohanlal; Arya; Sayyeshaa Saigal; Samuthirakani,6.2,,
Kanne Kalaimaane,Tamil,22/02/19,Romantic Drama,126,Seenu Ramasamy,Udhayanidhi Stalin; Tamannaah Bhatia,6.2,,
Marina Puratchi,Tamil,13/12/19,Drama,76,M. S. Raj,Naveen Kumar; Shruti Reddy,6.2,,
Adithya Varma,Tamil,22/11/19,Romantic Drama,167,Gireeshaaya,Dhruv Vikram; Banita Sandhu; Priya Anand,6.1,,
Aadai,Tamil,19/07/19,Thriller,143,Rathna Kumar,Amala Paul; Ananya Ramaprasad; Vivek Prasanna; Ramya Subramanian,6.1,,
Ayogya,Tamil,10/05/19,Action; Thriller,150,Venkat Mohan,Vishal; Raashii Khanna; R. Parthiban; K. S. Ravikumar; Pooja Devariya,6.1,,
Namma Veettu Pillai,Tamil,27/09/19,Action; Comedy; Drama,153,Pandiraj,Sivakarthikeyan; Aishwarya Rajesh; Anu Emmanuel; Samuthirakani; Soori,6,,
K-13,Tamil,03/05/19,Mystery; Thriller,104,Barath Neelakantan,Arulnithi; Shraddha Srinath; Gayathrie; Yogi Babu,6,,
Nenjamundu Nermaiyundu Odu Raja,Tamil,03/05/19,Comedy; Drama,118,R. Vivek,Rio Raj; RJ Vigneshkanth,6,,
,,,,,,,,,
Title,Language,Release Date,Genre(s),Runtime (mins),Director,Lead Actor(s),IMDb Rating (/10),BookMyShow Rating (/10),Average Rating (/10)
Padmavyuhathile Abhimanyu,Malayalam,03/08/19,Drama,130,Vineesh Aradya,Anoop Chandran; Indrans; Sona Nair,9.3,7.8,8.55
Kumbalangi Nights,Malayalam,07/07/19,Drama,135,Madhu C. Narayanan,"Shane Nigam, Fahadh Faasil, Soubin Shahir, Sreenath Bhasi",8.5,9.2,8.85
The Great Indian Road Movie,Malayalam,22/03/19,"Drama, Road, Travel",120,Sohanlal,"Suraj Venjaramoodu, Master Rudraksh",8.5,8.8,8.65
Adutha Chodyam,Malayalam,06/12/19,"Thriller, Drama",112,A.K.S. Nambiar,"Sreejith Ravi, Siju Wilson, Vinay Forrt",8.4,,
Vaarthakal Ithuvare,Malayalam,15/11/19,"Comedy, Thriller",121,Manoj Nair,"Nandhu, Siju Wilson, Vinay Forrt, Mammukoya",8.4,,
Upama,Malayalam,,Drama,82,Sasikanthan,"Manasa Prabhu, Anas Rahim J, Harikrishnan R.G.",8.2,,
Nalla Vishesham,Malayalam,,"Drama, Social",102,Sreeji Gopinathan,,8.1,,
Ennodu Para I Love You Ennu,Malayalam,,Romantic Comedy,116,,"Sooraj Thelakkadu, Ilhan, Al Sabith",8.1,,
Uyare,Malayalam,26/04/19,Drama,125,Manu Ashokan,"Parvathy Thiruvothu, Asif Ali, Tovino Thomas",8,9.1,8.55
Android Kunjappan Ver 5.25,Malayalam,11/08/19,"Comedy, Drama, Sci-Fi",140,Ratheesh Balakrishnan Poduval,"Suraj Venjaramoodu, Soubin Shahir, Kendy Zirdo",8,9.1,8.55
28,Malayalam,13/12/2019,"Thriller, Drama",105,Jiyen Krishnakumar,"Anoop Menon, Bhagath Manuel, Sreejith Ravi",8,,
Rakshapurushan,Malayalam,22/03/2019,"Thriller, Drama",122,Deepan Sivaraman,"Deepak Menon, Anu Nair",8,,
Thanneermathan Dinangal,Malayalam,26/07/2019,"Comedy, Romance, Drama",136,Girish A.D.,"Mathew Thomas, Vineeth Sreenivasan, Anaswara Rajan",7.8,8.7,8.25
Trees Under the Sun,Malayalam,08/07/19,"Drama, Social Issues",108,Dr. Biju,"Indrans, Prakash Bare",7.8,,
Virus,Malayalam,06/07/19,"Drama, Thriller, Medical",152,Aashiq Abu,"Kunchacko Boban, Parvathy Thiruvothu, Revathi, Tovino Thomas, Zakariya",7.7,9.2,8.45
Unda,Malayalam,14/06/2019,"Action, Drama, Political",130,Khalid Rahman,"Mammootty, Jacob Gregory, Rony David, Lukman Avaran",7.7,8.5,8.1
Helen,Malayalam,15/11/2019,"Thriller, Drama",117,Mathukutty Xavier,"Anna Ben, Lal, Noble Babu Thomas",7.7,9.1,8.4
Thamaasha,Malayalam,06/05/19,"Comedy, Drama",120,Ashraf Hamza,"Vinay Forrt, Chinnu Chandni",7.7,8.4,8.05
Pengalila,Malayalam,03/08/19,"Drama, Family, Social",111,T. V. Chandran,"Lal, Akshara Kishor",7.6,,
Unmadiyude Maranam,Malayalam,15/08/2019,"Fantasy, Satire",78,Harikumar V.S.,"Unni Maya, Saju Kodiyan",7.6,,
Ilayaraja,Malayalam,22/03/2019,Drama,141,Madhav Ramadasan,"Guinness Pakru, Gokul Suresh, Deepak Parambol",7.6,8.2,7.9
Lucifer,Malayalam,28/03/2019,"Action, Thriller, Political",175,Prithviraj Sukumaran,"Mohanlal, Vivek Oberoi, Manju Warrier, Tovino Thomas",7.5,8.9,8.2
Ishq,Malayalam,17/05/2019,"Drama, Romance, Thriller",134,Anuraj Manohar,"Shane Nigam, Ann Sheetal",7.5,8,7.75
Kettiyollaanu Ente Maalakha,Malayalam,22/11/2019,"Drama, Family",135,Nissam Basheer,"Asif Ali, Veena Nandakumar",7.5,8.5,8
Abode,Malayalam,05/04/19,Drama,83,Jiju Antony,"Seema Biswas, Anu Mohan",7.5,,
A Night A Day,Malayalam,10/12/19,Drama,76,Yamuna Chungappalli,"Yamuna Chungappalli, Kannan Nair",7.5,,
Kenjira,Malayalam,12/12/19,"Drama, Social",97,Manoj Kana,"Vinusha Ravi, Sreeya Suresh, Sreeraj",7.5,,
June,Malayalam,31/05/2019,"Coming-of-age, Drama",141,Ahammed Khabeer,"Rajisha Vijayan, Sarjano Khalid, Joju George",7.4,8.4,7.9
The Elder One,Malayalam,27/09/2019,Drama,125,Jeevan Job Thomas,"Shashank Arora, Nivin Pauly",7.4,,
Vikruthi,Malayalam,10/04/19,"Comedy, Drama, Social",123,Emcy Joseph,"Suraj Venjaramoodu, Soubin Shahir",7.4,8.6,8
Ningal Camera Nireekshanathilaanu,Malayalam,25/10/2019,"Thriller, Drama",117,Cibin Chandran,"Bhagath Manuel, Surabhi Lakshmi",7.4,,
Jallikattu,Malayalam,10/04/19,"Action, Drama, Thriller",95,Lijo Jose Pellissery,"Antony Varghese, Chemban Vinod Jose, Sabumon Abdusamad",7.3,8.7,8
Biriyaani,Malayalam,12/06/19,"Drama, Social",95,Sajin Baabu,"Kani Kusruti, Shailaja Jala, Shyam Reji",7.2,8.4,7.8
Driving Licence,Malayalam,20/12/2019,"Comedy, Drama",135,Jean Paul Lal (Lal Jr),"Prithviraj Sukumaran, Suraj Venjaramoodu",7.2,8.9,8.05
Lessons,Malayalam,18/10/2019,"Anthology, Drama",97,Shanil,"Devaki Rajendran, Rachana Narayanankutty",7.2,,
Vijay Superum Pournamiyum,Malayalam,01/11/19,"Drama, Romance",135,Jis Joy,"Asif Ali, Aishwarya Lekshmi",7.1,8.4,7.75
"1956, Central Travancore",Malayalam,11/08/19,"Historical, Drama",94,Don Palathara,"Assif Yogi, Jain Andrews",7.1,,
Ambili,Malayalam,08/09/19,"Comedy, Drama",140,Johnpaul George,"Soubin Shahir, Tanvi Ram",7,8.3,7.65
And the Oskar Goes To..,Malayalam,07/05/19,Drama,124,Salim Ahamed,"Tovino Thomas, Siddique, Anu Sithara",7,8.1,7.55
Finals,Malayalam,09/06/19,"Drama, Sports",122,P.R. Arun,"Rajisha Vijayan, Suraj Venjaramoodu, Niranj Maniyanpilla Raju",7,8,7.5
Luca,Malayalam,28/06/2019,Romantic Thriller,151,Arun Bose,"Tovino Thomas, Ahaana Krishna",6.9,8.6,7.75
Prathi Poovankozhi,Malayalam,20/12/2019,"Thriller, Drama",102,Rosshan Andrrews,"Manju Warrier, Anusree, Rosshan Andrrews",6.9,8.3,7.6
Thottappan,Malayalam,07/05/19,Drama,140,Shanavas K Bavakutty,"Vinayakan, Priyamvada Krishnan",6.9,7.8,7.35
Porinju Mariyam Jose,Malayalam,23/08/2019,"Action, Drama",148,Joshiy,"Joju George, Nyla Usha, Chemban Vinod Jose",6.8,8.2,7.5
Manoharam,Malayalam,27/09/2019,"Comedy, Drama",122,Anvar Sadik,"Vineeth Sreenivasan, Aparna Das",6.8,8.5,7.65
9,Malayalam,02/07/19,"Sci-Fi, Thriller, Drama",149,Jenuse Mohamed,"Prithviraj Sukumaran, Mamta Mohandas, Wamiqa Gabbi",6.7,8.1,7.4
Anukoni Athidhi,Malayalam,04/12/19,"Thriller, Psychological",136,Vivek,"Fahadh Faasil, Sai Pallavi",6.7,8.4,7.55
Swapnarajyam,Malayalam,17/05/2019,"Drama, Inspirational",125,Ranjith Vijay,"Jagadish, Sunil Sukhada, Maala Parvathi",6.7,,
Ormayil Oru Shishiram,Malayalam,13/09/2019,"Romance, Coming-of-age",133,Vivek Aryan,"Anaswara Ponnambath, Deepak Parambol",6.7,7.9,7.3
Swarna Malsyangal,Malayalam,17/05/2019,"Drama, Comedy, Children",118,Ajeesh Antony,"Anand Babu, Devika Rajendran, Master Arjun",6.7,,
Naan Petta Makan,Malayalam,03/01/19,"Drama, Political",132,Shaan Thulasidharan,"Minon, Joy Mathew, Sreenivasan",6.7,7.9,7.3
Hridyam,Malayalam,12/06/19,"Short Film, Drama",97,Lijin Jose,"Kannan Nair, Sreekutty",6.6,,
Munthiri Monchan,Malayalam,25/10/2019,"Comedy, Romance",130,Vijith Nambiar,"Manesh Krishnan, Gopika Anil, Devan, Innocent",6.6,7.6,7.1
Mohabbathin Kunjabdulla,Malayalam,11/08/19,"Romance, Comedy",135,Shanu Samad,"Indrans, Anju Aravind, Balu Varghese",6.6,,
Mr. Pavanayi 99.99,Malayalam,28/06/2019,"Action, Comedy, Thriller",110,Babu Pisharody,"Ullas Panthalam, Captain Raju, Kottayam Nazeer",6.6,,
Kakshi: Amminippilla,Malayalam,28/06/2019,"Comedy, Drama, Courtroom",135,Dinjith Ayyathan,"Asif Ali, Ahmed Sidhique, Basil Joseph",6.5,7.8,7.15
Janamaithri,Malayalam,19/07/2019,"Comedy, Satire",122,John Manthrickal,"Saiju Kurup, Indrans, Sabumon Abdusamad",6.5,8.2,7.35
Varikkuzhiyile Kolapathakam,Malayalam,22/02/2019,"Crime, Thriller",120,Rejishh Midhila,"Amith Chakalakkal, Dileesh Pothan, Lena",6.5,8,7.25
Eelam,Malayalam,01/11/19,"Crime, Drama",115,Arun Sivaprasad,"Sreejith Ravi, Anumol, Sreevidya Mullachery",6.5,,
Isakkinte Ithihasam,Malayalam,02/01/19,"Drama, Family, Comedy",135,R.K. Ajayakumar,"Kani Kusruti, Siddique, Dain Davis",6.5,,
Ormma,Malayalam,18/10/2019,Drama,127,Suresh Thiruvalla,"Gayathri Arun, Sreevidya Mullachery",6.4,,
Gramavasees,Malayalam,18/01/2019,"Satire, Drama",113,M. R. Anoop,"Indrans, Azees Nedumangad, Santhosh Keezhattoor",6.4,,
Pattabhiraman,Malayalam,23/08/2019,"Comedy, Drama",139,Kannan Thamarakkulam,"Jayaram, Miya George, Dharmajan Bolgatty",6.3,7.7,7
Run Kalyani,Malayalam,10/03/19,"Drama, Art House",100,Geetha J.,"Garggi Ananthan, Ramesh Varma",6.3,,
Freakens,Malayalam,02/08/19,"Thriller, Comedy",124,Anish J. Karrinad,"Indrans, Biju Sopanam",6.3,,
Praana,Malayalam,18/01/2019,"Thriller, Psychological",107,V.K. Prakash,Nithya Menen,6.2,7.8,7
Patham Classile Pranayam,Malayalam,03/01/19,"Romance, Drama",121,"Arjun Prabhakaran, Gokul Ramakrishnan","Sarangi Suresh, Shanavas Shanu",6.2,7.6,6.9
Thanka Bhasma Kuriyitta Thamburatty,Malayalam,22/11/2019,"Fantasy, Satire",134,Sajimon Parayil,"Seema G. Nair, Kalabhavan Navas",6.1,,
Bolivia,Malayalam,07/05/19,"Crime, Thriller, Drama",122,Anil Radhakrishnan Menon,"Neena Kurup, Soumya Sadanandan",6.1,,
Sullu,Malayalam,20/12/2019,"Thriller, Drama",102,V.R. Gopalakrishnan,"Master Vasudev, Anumol, Santhosh Keezhattoor",6,,
Rameshan Oru Peralla,Malayalam,13/12/2019,Drama,120,Sujith Vigneshwar,"Divyadarshan, Shailaja Ambu, Manikandan, Rajesh Sharma",6,,
Ottam,Malayalam,09/06/19,"Drama, Youth",120,Zam,"Roshan Ullas, Nandu Anand",6,,
Vallikkettu,Malayalam,27/09/2019,"Romance, Drama",114,Jibu Tony,"Ashkar Saudan, Pooja Mohanraj",6,,
Oru Caribbean Udayippu,Malayalam,04/05/19,"Musical, Campus, Drama",131,A.J. Joseph,"Vishnu Govindhan, Mareena Michael, Aneesh Menon",6,,
Janaadhipan,Malayalam,05/10/19,"Political, Drama, Thriller",120,Thanseer M.A.,"Hareesh Peradi, Vani Kishore, Sunil Sukhada",6,,
Oru Mass Kadha Veendum,Malayalam,03/01/19,"Comedy, Action, Drama",153,Vinu Ramachandran,"Mammukoya, Bheeman Raghu, Dinesh Panicker",6,,
,,,,,,,,,
Title,Language,Release Date,Genre(s),Runtime (mins),Director,Lead Actor(s),IMDb Rating (/10),BookMyShow Rating (/10),Average Rating (/10)
Pichhodu,Telugu,20/12/2019,"Drama, Romance",128,Srinivas Chanderi,"Vamshi, Harika, Madhu",9.3,,
Beach Road Chetan,Telugu,03/08/19,Thriller,137,Chetan Maddineni,"Chetan Maddineni, Teja Reddy, Aadi",9.2,,
Gor Jeevan,Telugu,08/02/19,Drama,141,Kpn Chawhan,"Gor Jeevan, Nisha Patel",9.1,,
Jersey,Telugu,19/04/2019,"Sports, Drama",157,Gowtam Tinnanuri,"Nani, Shraddha Srinath, Sathyaraj",8.5,9.3,8.9
Pawanism 2,Telugu,09/01/19,"Action, Drama",125,A. Mahesh Kumar,"Kalyan, Vamsi Krishna, Srikanth",8.4,,
Agent Sai Srinivasa Athreya,Telugu,21/06/2019,"Crime, Comedy, Thriller",148,Swaroop RSJ,"Naveen Polishetty, Shruti Sharma, Suhas",8.3,9,8.65
Kaliyuga,Telugu,27/09/2019,"Thriller, Sci-Fi",129,Surya M,"Surya M, Tejaswi Madivada",8.3,,
Mathu Vadalara,Telugu,25/12/2019,"Crime, Thriller, Comedy",130,Ritesh Rana,"Sri Simha Koduri, Satya, Naresh Agastya",8.2,8.9,8.55
Mallesham,Telugu,21/06/2019,"Biopic, Drama",131,Raj Rachakonda,"Priyadarshi, Jhansi, Ananya",8.2,8.7,8.45
Madhanam,Telugu,12/06/19,"Thriller, Romance",128,Ajay Sai Manikandan,"Ajay Sai Manikandan, Sneha, Vinay",8.2,,
Evaru,Telugu,15/08/2019,"Thriller, Crime, Mystery",118,Venkat Ramji,"Adivi Sesh, Regina Cassandra, Naveen Chandra",8.1,8.6,8.35
Ayyappa Kataksham,Telugu,12/06/19,"Devotional, Drama",137,B. Harinath,"Dileep, Ramu, Pranathi, Arun",8.1,,
Brochevarevarura,Telugu,28/06/2019,"Comedy, Crime, Drama",138,Vivek Athreya,"Sree Vishnu, Nivetha Thomas, Nivetha Pethuraj, Satya",8,8.7,8.35
Rakshasudu,Telugu,08/02/19,"Thriller, Crime",122,Ramesh Varma,"Bellamkonda Sai Srinivas, Anupama Parameswaran, Saravanan",7.9,8.4,8.15
Romantic Criminals,Telugu,17/05/2019,"Drama, Romance, Crime",126,Suneel Kumar Reddy,"Avantika Munni, Divya Vijju, K. Vinay",7.8,,
"Wife, i",Telugu,14/02/2019,"Thriller, Drama",125,GSSP Kalyan,"Kalyan, Mahesh Reddy, Jyothi",7.7,,
Swayamvada,Telugu,08/09/19,"Psychological, Romance",131,Suneel Kumar Reddy,"Aditya Alluri, Anika Rao, Krishna Murali Posani",7.7,,
Raghupathi Venkaiah Naidu,Telugu,29/11/2019,"Biopic, Historical",97,Babji,Naresh Vijaya Krishna,7.7,,
Gang Leader,Telugu,13/09/2019,"Action, Comedy, Revenge",155,Vikram K. Kumar,"Nani, Priyanka Arul Mohan, Kartikeya Gummakonda",7.6,8.2,7.9
Ranasthalam,Telugu,22/11/2019,"Action, Drama",125,Bandi Saroj Kumar,"Mahesh Babu Kalidindi, Alekhya Sharma",7.6,,
Rahasyam,Telugu,22/02/2019,"Horror, Thriller",100,Srinivas Gopisetty,"Ravi Babu, Rithika",7.5,,
Prementha Panichese Narayana,Telugu,21/06/2019,Romantic Comedy,122,Jonnalagadda Srinivas,"Akshitha, Tarun Shetty",7.5,,
Raja Vaaru Rani Gaaru,Telugu,29/11/2019,"Romance, Drama",133,Ravi Kiran Kola,"Kiran Abbavaram, Rahasya Gorak",7.4,8,7.7
Dear Comrade,Telugu,26/07/2019,"Action, Romance, Drama",169,Bharat Kamma,"Vijay Deverakonda, Rashmika Mandanna",7.3,8.6,7.95
Majili,Telugu,04/05/19,"Romance, Drama",154,Shiva Nirvana,"Naga Chaitanya, Samantha Ruth Prabhu",7.3,8.4,7.85
Oh Baby,Telugu,07/05/19,"Fantasy, Comedy, Drama",161,B. V. Nandini Reddy,"Samantha Ruth Prabhu, Lakshmi",7.3,8.7,8
Sye Raa Narasimha Reddy,Telugu,10/02/19,"Historical, Action, War",167,Surender Reddy,"Chiranjeevi, Amitabh Bachchan, Nayanthara",7.2,8.3,7.75
Prema Janta,Telugu,25/10/2019,"Romance, Drama",128,Shivaraj Kanumuri,"Venkat Krishna, Swetha Varma",7.2,,
Maharshi,Telugu,05/09/19,"Action, Drama, Inspirational",176,Vamshi Paidipally,"Mahesh Babu, Pooja Hegde, Allari Naresh",7.1,8.8,7.95
Boy,Telugu,23/08/2019,"Coming-of-age, Drama",129,Amar Viswaraj,"Lakshya Sinha, Sahithi Dasari",7.1,,
Chitralahari,Telugu,04/12/19,"Drama, Romance",131,Kishore Tirumala,"Sai Dharam Tej, Kalyani Priyadarshan, Nivetha Pethuraj",7.1,8.1,7.6
Kousalya Krishnamurthy,Telugu,23/08/2019,"Sports, Drama",149,Bhimaneni Srinivasa Rao,"Aishwarya Rajesh, Sivakarthikeyan",7.1,7.7,7.4
Mouname Ishtam,Telugu,25/10/2019,"Romance, Drama",135,Srikanth Ranganathan,"Ashok Galla, Sri Nikitha",7.1,,
Evvarikee Cheppoddu,Telugu,11/08/19,"Drama, Romance",133,Basava Shankar Eeday,"Rakesh Varre, Gargeyi Yellapragada",7,7.8,7.4
Ajay Passayyadu,Telugu,29/11/2019,"Action, Romance",122,Siva Reddy Sanapala,"Ajay, Ambika Vani",7,,
Evadu Thakkuva Kadu,Telugu,18/01/2019,"Action, Drama",125,R.R.K.,"Ajay, Abhiram, Yamini",7,,
Heza,Telugu,12/12/19,"Horror, Thriller",111,Munna Kasi,"Munna Kasi, Mumait Khan",6.9,7.6,7.25
George Reddy,Telugu,22/11/2019,"Biopic, Political, Drama",153,Jeevan Reddy,"Sandeep Madhav, Muskaan Khubchandani",6.9,8,7.45
Kalki,Telugu,28/06/2019,"Action, Crime, Mystery",140,Prashanth Varma,"Rajasekhar, Adah Sharma, Nandita Swetha",6.8,7.9,7.35
Nuvvu Thopu Raa,Telugu,05/03/19,"Drama, Romance",150,Harinath Babu B.,"Sudhakar Komakula, Nitya Shetty",6.8,,
Happy Journey,Telugu,06/07/19,"Drama, Road Trip, Thriller",110,Venkatesh Naidu,"Anjali, Uttej, Swathi",6.8,,
Jessie,Telugu,15/03/2019,"Horror, Thriller",106,Aswani Kumar V.,"Pavani Gangireddy, Abhinav Gomatam",6.7,7.4,7.05
Bailampudi,Telugu,07/12/19,"Action, Drama",115,Raj Nalli,"Harish Vinay, Tanishq Rajan",6.7,,
Madhaveeyam,Telugu,20/12/2019,Romantic Drama,137,Vineeth,"Vineeth, Radhika",6.7,,
Arjun Suravaram,Telugu,29/11/2019,"Action, Thriller",108,T. Santhosh,"Nikhil Siddharth, Lavanya Tripathi",6.6,8.2,7.4
Rajdooth,Telugu,07/12/19,"Adventure, Drama",130,"Arjun, Carthyk","Meghamsh Srihari, Nakshatra Babu",6.6,,
Undiporaadhey,Telugu,09/06/19,"Romance, Period Drama",139,Naveen Nayani,"Tharun Tej, Lavanya",6.5,,
Akkadokaduntadu,Telugu,25/10/2019,"Crime, Comedy, Thriller",120,Siva Kantamneni,"Ram Karthik, Preethi Nigam",6.5,,
118,Telugu,03/01/19,"Action, Mystery, Thriller",120,K. V. Guhan,"Kalyan Ram, Nivetha Thomas, Shalini Pandey",6.4,7.9,7.15
Lakshmi's NTR,Telugu,29/03/2019,"Biopic, Political Drama",152,Ram Gopal Varma,"P. Vijay Kumar, Yagna Shetty, Rajasekhar Aningi",6.4,7.2,6.8
2 Hours Love,Telugu,05/10/19,"Romance, Drama",150,Deepak Balan,"Prajit Neel, Megha Gupta",6.4,,
Prati Roju Pandaage,Telugu,17/10/2019,"Drama, Family",146,Maruthi,"Sai Dharam Tej, Sathyaraj, Rohini",6.3,8,7.15
Gaddalakonda Ganesh,Telugu,20/09/2019,"Action, Comedy, Drama",130,Harish Shankar,"Varun Tej, Pooja Hegde, Atharvaa",6.3,8.1,7.2
Falaknuma Das,Telugu,07/05/19,"Crime, Thriller, Drama",145,Vishwak Sen,"Vishwak Sen, Uttej, Santhy Balachandran",6.3,7.8,7.05
Krishna Rao Supermarket,Telugu,14/04/2019,Drama,149,Sreenath Pulakuram,"Krishna, Elsa Ghosh",6.3,,
Yedu Chepala Katha,Telugu,23/08/2019,"Comedy, Romance",124,Karthikeya Gummakonda,"Ravi, Bhavana Nandi",6.2,,
Guna 369,Telugu,11/08/19,"Action, Crime, Drama",146,Arjun,Karthikeya Gummakonda,6.2,,
Meeku Maathrame Chepta,Telugu,19/07/2019,"Comedy, Drama",140,Shammeer Sultan,"Sujith Shanker, Anuhya",6.2,7.6,6.9
Thupaki Ramudu,Telugu,13/09/2019,"Romance, Comedy",136,C. Sathish Kumar,"Siva Karthikeyan, Meghali, Abhinayashree Dagala",6.2,,
F2: Fun and Frustration,Telugu,01/12/19,"Comedy, Romance",148,Anil Ravipudi,"Venkatesh Daggubati, Varun Tej, Tamannaah Bhatia, Mehreen Pirzada",6.1,8.2,7.15
Mr. Majnu,Telugu,02/01/19,"Romance, Comedy",145,Venky Atluri,"Akhil Akkineni, Nidhhi Agerwal",6.1,7.1,6.6
Dhrusti,Telugu,05/10/19,"Thriller, Crime",120,S. Srinivas,— (Priyadarshi),6.1,,
Ek,Telugu,08/09/19,"Action, Thriller",129,Sangeeth Sivan,—,6.1,,
Cobra,Telugu,15/11/2019,"Action, Crime",135,Harish Shankar,Ram Gopal Varma,6.1,,
Ranarangam,Telugu,14/06/2019,"Action, Thriller",138,Sudheer Varma,Sharwanand,6,7,6.5
Vinara Sodara Veera Kumara,Telugu,22/09/2019,"Drama, Fantasy",144,Ravi Teja (not actor),Ramana Kumar,6,,
Diksoochi,Telugu,26/07/2019,"Mystery, Thriller",120,Selva Kumar,—,6,,
Kothaga Maa Prayanam,Telugu,10/12/19,"Romance, Drama",136,Sree Bala Boopathy,"Priyanth, Yamini Bhaskar",6,,
,,,,,,,,,
Title,Language,Release Date,Genre(s),Runtime (mins),Director,Lead Actor(s),IMDb Rating (/10),BookMyShow Rating (/10),Average Rating (/10)
Shree Atharvana Prathyangira,Kannada,22‑Mar‑2019,Drama,122,Sri Sapthagiri Amma,Anu Krishna,9.2,7.7,
Digbhayam,Kannada,24‑May‑2019,"Horror, Thriller, Drama",107,Amith,"Amith, Kavitha Bist, Monisha & Hamsa Gowda",8.9,,
Omme Nishyabda Omme Yudda,Kannada,31‑May‑2019,Romantic Drama,120,Sree Nag,"Samyuktha Hegde, Prabhu Mundkur, Vijay Bholenath",8.5,7.1,
Udumba,Kannada,23‑Aug‑2019,"Action, Romance, Drama",132,Shivaraj,"Pawan Shourya, Chirashree Anchan, Sharath Lohitashwa",8.5,,
Ranahedi,Kannada,29‑Nov‑2019,Drama,149,Manu K Shettahalli,"Karna Kumar, Aishwarya Rao, Achyuth Kumar",8.5,,
Kempe Gowda 2,Kannada,09‑Aug‑2019,"Action, Political Thriller",139,Shankar Gowda,"Komal Kumar, Rakshika Sharma, S. Sreesanth",8.4,,
Siddhi Seere,Kannada,11‑Oct‑2019,Drama,137,Brahmanand Reddy & K.N. Krishnamurthy Rao,Sudha Narasimharaju,8.4,,
Gini Helida Kathe,Kannada,18‑Jan‑2019,"Comedy, Romance, Drama",138,Nagaraja Uppunda,"Dev Rangabhoomi, Malathesh",8.4,,
Mookajjiya Kanasugalu,Kannada,29‑Nov‑2019,"Fantasy, Drama",133,P. Sheshadri,"B. Jayashree, Kavya Shah, Arvind Kuplikar",8.3,,
Lungi,Kannada,11‑Oct‑2019,"Romance, Drama",115,"Arjun Lewis, Akshith Shetty","Pranav Hegde, Ahalya Suresh, Radhika Rao, Prakash Thuminad",8.3,8,8.15
Lambodara,Kannada,15-Mar-19,"Comedy, Drama",124,Praveen Reddy T,"Sathvika Appaiah, Akshay, Shruti Prakash",8.2,,
i1,Kannada,06-Sep-19,"Thriller, Mystery, Drama",120,Abhishek Shetty,"Vishwa, Sidharth, Arjun",8.2,,
